{
  "version": 2,
  "output": "Annex.pdf",
  "page": { "text": { "value": "This page intentionally left blank", "anchor": "bottom", "y": "20mm" } },
  "items": [
    "cover.pdf",
    { "page": {} },
    { "dir": "sections", "items": ["01.pdf", "02.pdf"] },
    { "page": { "text": { "value": "Appendix", "size": 24 } }, "count": 2 },
    "appendix.pdf"
  ]
}
